{
  "schema_version": "kernel-tcb/v1",
  "generator_contract_version": "kernel-tcb-generator/v1",
  "roots": [
    {
      "id": "workspace-bootstrap",
      "path": "harness.ps1",
      "trust_path": "distribution",
      "role": "Bootstrap and reconcile installed Workspace assets, then project status.",
      "layer": "d1-distribution",
      "reason": "The Distribution Trust Path is inventoried separately so the complete installer never becomes a K1 dependency or Runtime budget input."
    },
    {
      "id": "codex-pretooluse-launcher",
      "path": "runtime-hooks/claude/codex-pretooluse-launcher.ps1",
      "trust_path": "runtime",
      "role": "Bridge Codex Hook transport to the installed PreToolUse adapter.",
      "layer": "a3-adapter",
      "reason": "The launcher fails closed and is part of the installed Codex protected-write path."
    },
    {
      "id": "claude-pretooluse-adapter",
      "path": "runtime-hooks/claude/pretooluse.ps1",
      "trust_path": "runtime",
      "role": "Deserialize Claude/Codex tool input and call K1 preflight_action.",
      "layer": "a3-adapter",
      "reason": "Host mutation transport remains selected while patch, path, and Policy authority move into Harness.AdapterAction."
    },
    {
      "id": "entry-contract-compiler",
      "path": "scripts/generate-entry-contract.ps1",
      "trust_path": "runtime",
      "role": "Compile and verify the canonical Entry Contract bootstrap.",
      "layer": "k1-runtime-kernel",
      "reason": "Entry Contract is an irreducible Harness trust responsibility."
    },
    {
      "id": "status-cli",
      "path": "scripts/harness-status.ps1",
      "trust_path": "runtime",
      "role": "Read-only Runtime, protocol, host-capability, and protected-policy status projection.",
      "layer": "k1-runtime-kernel",
      "reason": "Status is a separate read-only root and must not be inferred from task creation."
    },
    {
      "id": "controlled-write-adapter",
      "path": "scripts/harness-write-mcp.ps1",
      "trust_path": "runtime",
      "role": "MCP host adapter for Kernel-controlled file writes.",
      "layer": "a3-adapter",
      "reason": "Covers the ordinary controlled-write entry independent of Hook activation."
    },
    {
      "id": "risk-policy-evaluator",
      "path": "scripts/lib/Harness.Policy.psm1",
      "trust_path": "runtime",
      "role": "Resolve risk routing and execution-profile requirements.",
      "layer": "k1-runtime-kernel",
      "reason": "Risk Routing is an irreducible Harness trust responsibility even though host prose performs the first inline classification hop."
    },
    {
      "id": "task-cli",
      "path": "scripts/task.ps1",
      "trust_path": "runtime",
      "role": "Requirement, task lifecycle, status, recovery, Evidence, and Approval CLI.",
      "layer": "k1-runtime-kernel",
      "reason": "Covers ordinary durable task and status trust paths."
    }
  ],
  "files": [
    {
      "path": "harness.ps1",
      "sha256": "sha256:e065551af2a7ed9b3642f6372c78e62465ac3e6647cb819a69c82d5cbc5cb337",
      "layer": "d1-distribution",
      "trust_paths": [
        "distribution"
      ],
      "root_ids": [
        "workspace-bootstrap"
      ],
      "physical_loc": 403,
      "nonblank_loc": 344,
      "executable_loc": 340
    },
    {
      "path": "install.ps1",
      "sha256": "sha256:e3faeb77e3f32b01533f4b703822020a1ad4b21167df9b12b4977b5b4c66174b",
      "layer": "d1-distribution",
      "trust_paths": [
        "distribution"
      ],
      "root_ids": [
        "workspace-bootstrap"
      ],
      "physical_loc": 3430,
      "nonblank_loc": 3159,
      "executable_loc": 3137
    },
    {
      "path": "runtime-hooks/claude/codex-pretooluse-launcher.ps1",
      "sha256": "sha256:160dc6a41a9207f600bcb6825f76fd043ab618ca5b988f53023efa41828d3a7e",
      "layer": "a3-adapter",
      "trust_paths": [
        "runtime"
      ],
      "root_ids": [
        "codex-pretooluse-launcher"
      ],
      "physical_loc": 113,
      "nonblank_loc": 105,
      "executable_loc": 103
    },
    {
      "path": "runtime-hooks/claude/pretooluse.ps1",
      "sha256": "sha256:6a9f25000af854ffa6e71cbdefe21d226362f63e655152970e53c48c88bc320e",
      "layer": "a3-adapter",
      "trust_paths": [
        "runtime"
      ],
      "root_ids": [
        "claude-pretooluse-adapter",
        "codex-pretooluse-launcher"
      ],
      "physical_loc": 84,
      "nonblank_loc": 79,
      "executable_loc": 79
    },
    {
      "path": "scripts/generate-entry-contract.ps1",
      "sha256": "sha256:3fa4af32490c881659b3797645f607a6e7a338b4d6110fd8936193e6bae89c3e",
      "layer": "k1-runtime-kernel",
      "trust_paths": [
        "runtime"
      ],
      "root_ids": [
        "entry-contract-compiler"
      ],
      "physical_loc": 212,
      "nonblank_loc": 193,
      "executable_loc": 193
    },
    {
      "path": "scripts/harness-status.ps1",
      "sha256": "sha256:87f59d978a4a0032ea7fa99b58587eaf7e494361563103ca7a32106d9ad746e5",
      "layer": "k1-runtime-kernel",
      "trust_paths": [
        "distribution",
        "runtime"
      ],
      "root_ids": [
        "status-cli",
        "workspace-bootstrap"
      ],
      "physical_loc": 102,
      "nonblank_loc": 95,
      "executable_loc": 94
    },
    {
      "path": "scripts/harness-write-mcp.ps1",
      "sha256": "sha256:91ecd3462f809f77d8e1035d4f9dc39149e5e5f7d1112136edd51b3589cb76a8",
      "layer": "a3-adapter",
      "trust_paths": [
        "runtime"
      ],
      "root_ids": [
        "controlled-write-adapter"
      ],
      "physical_loc": 194,
      "nonblank_loc": 183,
      "executable_loc": 183
    },
    {
      "path": "scripts/install-transaction-common.ps1",
      "sha256": "sha256:765d438e4539db6c4adf9d80a1334a0c8b25af9a39a8db09fa55caede3f75b5f",
      "layer": "d1-distribution",
      "trust_paths": [
        "distribution"
      ],
      "root_ids": [
        "workspace-bootstrap"
      ],
      "physical_loc": 1368,
      "nonblank_loc": 1251,
      "executable_loc": 1250
    },
    {
      "path": "scripts/lib/Harness.AdapterAction.psm1",
      "sha256": "sha256:dcb225e6382e75fe9038066f977afdd3f3b8814c69c7ad4ce3646a088e935eaa",
      "layer": "k1-runtime-kernel",
      "trust_paths": [
        "runtime"
      ],
      "root_ids": [
        "claude-pretooluse-adapter",
        "codex-pretooluse-launcher",
        "controlled-write-adapter"
      ],
      "physical_loc": 307,
      "nonblank_loc": 286,
      "executable_loc": 286
    },
    {
      "path": "scripts/lib/Harness.Approval.psm1",
      "sha256": "sha256:9bff199ac9a411d0c7ba7f1b075b4bad022160e9e02561caec58a9b9a4b56725",
      "layer": "k1-runtime-kernel",
      "trust_paths": [
        "distribution",
        "runtime"
      ],
      "root_ids": [
        "claude-pretooluse-adapter",
        "codex-pretooluse-launcher",
        "controlled-write-adapter",
        "status-cli",
        "task-cli",
        "workspace-bootstrap"
      ],
      "physical_loc": 189,
      "nonblank_loc": 175,
      "executable_loc": 175
    },
    {
      "path": "scripts/lib/Harness.AtomicWrite.psm1",
      "sha256": "sha256:9f0d67756cd10d8fe8c3dd96d5556ba1cbfef40238bec2efc05407e2a5e3dc49",
      "layer": "k0-trust-primitive",
      "trust_paths": [
        "distribution",
        "runtime"
      ],
      "root_ids": [
        "claude-pretooluse-adapter",
        "codex-pretooluse-launcher",
        "controlled-write-adapter",
        "risk-policy-evaluator",
        "status-cli",
        "task-cli",
        "workspace-bootstrap"
      ],
      "physical_loc": 166,
      "nonblank_loc": 152,
      "executable_loc": 152
    },
    {
      "path": "scripts/lib/Harness.ControlledWrite.psm1",
      "sha256": "sha256:a8f05e91304a2db8027c6b33644aea1ab15cd75224a10f0f2296b73b989846a9",
      "layer": "k1-runtime-kernel",
      "trust_paths": [
        "runtime"
      ],
      "root_ids": [
        "claude-pretooluse-adapter",
        "codex-pretooluse-launcher",
        "controlled-write-adapter"
      ],
      "physical_loc": 145,
      "nonblank_loc": 134,
      "executable_loc": 134
    },
    {
      "path": "scripts/lib/Harness.Evidence.psm1",
      "sha256": "sha256:483962f86efcc250a9a9a2c495a2fefdb958d8cbc11540a0b437b085f0f2046e",
      "layer": "k1-runtime-kernel",
      "trust_paths": [
        "runtime"
      ],
      "root_ids": [
        "task-cli"
      ],
      "physical_loc": 274,
      "nonblank_loc": 262,
      "executable_loc": 262
    },
    {
      "path": "scripts/lib/Harness.Governance.psm1",
      "sha256": "sha256:de5249c21fac0b7e6ef60090c35716ab79e8b9d090eb2c211c6fa646448bda3d",
      "layer": "k1-runtime-kernel",
      "trust_paths": [
        "runtime"
      ],
      "root_ids": [
        "task-cli"
      ],
      "physical_loc": 141,
      "nonblank_loc": 129,
      "executable_loc": 129
    },
    {
      "path": "scripts/lib/Harness.Hashing.psm1",
      "sha256": "sha256:8308d40f9e9ee1fbe4233e25a405e7865803171de5aa255309dbd95d9d5171f2",
      "layer": "k0-trust-primitive",
      "trust_paths": [
        "distribution",
        "runtime"
      ],
      "root_ids": [
        "claude-pretooluse-adapter",
        "codex-pretooluse-launcher",
        "controlled-write-adapter",
        "entry-contract-compiler",
        "risk-policy-evaluator",
        "status-cli",
        "task-cli",
        "workspace-bootstrap"
      ],
      "physical_loc": 44,
      "nonblank_loc": 34,
      "executable_loc": 34
    },
    {
      "path": "scripts/lib/Harness.HostCapabilities.psm1",
      "sha256": "sha256:d821885c57223f359919b1b4372e2f134c225e4b008e428af0119ae12b2ccfc0",
      "layer": "k1-runtime-kernel",
      "trust_paths": [
        "distribution",
        "runtime"
      ],
      "root_ids": [
        "risk-policy-evaluator",
        "status-cli",
        "task-cli",
        "workspace-bootstrap"
      ],
      "physical_loc": 233,
      "nonblank_loc": 217,